{
	"$schema": "http://json-schema.org/draft-07/schema#",
	"title": "Project Schema",
	"type": "object",
	"properties": {
		"id": {
			"type": "integer"
		},
		"project_name": {
			"type": "string"
		},
		"description": {
			"type": "string"
		},
		"year": {
			"type": "integer"
		},
		"month": {
			"type": "integer"
		},
		"role": {
			"type": "string"
		},
		"project_type": {
			"type": "string"
		},
		"technologies_used": {
			"type": "array",
			"items": {
				"type": "object",
				"properties": {
					"name": { "type": "string" },
					"description": { "type": "string" }
				},
				"required": ["name", "description"],
				"additionalProperties": false
			}
		},
		"infrastructure": {
			"type": "array",
			"items": {
				"type": "object",
				"properties": {
					"name": { "type": "string" },
					"description": { "type": "string" },
					"steps": {
						"type": "array",
						"items": { "type": "string" }
					}
				},
				"required": ["name", "description", "steps"],
				"additionalProperties": false
			}
		},
		"skills_required": {
			"type": "array",
			"items": {
				"type": "object",
				"properties": {
					"name": { "type": "string" },
					"description": { "type": "string" }
				},
				"required": ["name", "description"],
				"additionalProperties": false
			}
		},
		"challenges_faced": {
			"type": "array",
			"items": {
				"type": "object",
				"properties": {
					"name": { "type": "string" },
					"description": { "type": "string" }
				},
				"required": ["name", "description"],
				"additionalProperties": false
			}
		},
		"outcomes": {
			"type": "array",
			"items": {
				"type": "object",
				"properties": {
					"name": { "type": "string" },
					"description": { "type": "string" }
				},
				"required": ["name", "description"],
				"additionalProperties": false
			}
		},
		"links": {
			"type": "array",
			"items": {
				"type": "object",
				"properties": {
					"name": { "type": "string" },
					"url": { "type": "string" }
				},
				"required": ["name", "url"],
				"additionalProperties": false
			}
		}
	},
	"required": [
		"id",
		"project_name",
		"description",
		"year",
		"month",
		"role",
		"project_type",
		"technologies_used",
		"infrastructure",
		"skills_required",
		"challenges_faced",
		"outcomes",
		"links"
	],
	"additionalProperties": false
}
