{
	"id": 1,
	"project_name": "Terraform for AWS",
	"description": "Automated deployment of AWS infrastructure using Terraform, including VPC, MongoDB setup, EC2 instances, and ALB configuration.",
	"year": 2023,
	"month": 9,
	"role": "",
	"project_type": "individual",
	"technologies_used": [
		{
			"name": "Terraform",
			"description": "Infrastructure as Code tool for automating AWS resource provisioning."
		},
		{
			"name": "AWS EC2",
			"description": "Compute service for hosting application servers."
		},
		{
			"name": "AWS VPC & Subnets",
			"description": "Proficiency in configuring VPCs, subnets (public/private), and routing for secure network communications."
		},
		{
			"name": "AWS ALB",
			"description": "Application Load Balancer for distributing traffic across EC2 instances."
		},
		{
			"name": "AWS MongoDB",
			"description": "NoSQL database used for application data storage."
		}
	],
	"infrastructure": [
		{
			"name": "VPC Setup",
			"description": "Created a secure VPC with public and private subnets, routing tables, and security groups.",
			"steps": [
				"Provisioned public and private subnets.",
				"Configured routing tables and Internet Gateways.",
				"Set up security groups for traffic control."
			]
		},
		{
			"name": "AWS MongoDB Deployment",
			"description": "Hosted MongoDB on EC2 with secure access and automated backups.",
			"steps": [
				"Configured MongoDB instances with EBS volumes.",
				"Implemented security groups for database access control.",
				"Automated backups using AWS Snapshot."
			]
		},
		{
			"name": "EC2 Instance Setup",
			"description": "Configured EC2 instances with IAM roles and security groups for application hosting.",
			"steps": [
				"Launched EC2 instances with required IAM roles.",
				"Set up security groups for SSH and application traffic."
			]
		},
		{
			"name": "Application Load Balancer (ALB) Setup",
			"description": "Configured ALB to distribute traffic across multiple EC2 instances.",
			"steps": [
				"Provisioned ALB with target groups for EC2 instances.",
				"Set up HTTPS listeners with SSL certificates."
			]
		}
	],
	"skills_required": [
		{
			"name": "Terraform",
			"description": "Proficient in using Terraform for Infrastructure as Code."
		},
		{
			"name": "AWS Networking",
			"description": "Experience with VPCs, subnets, routing tables, and security groups."
		},
		{
			"name": "NoSQL Databases",
			"description": "Expertise in deploying and managing MongoDB."
		},
		{
			"name": "Load Balancing",
			"description": "Configuring ALB for scalable and secure traffic distribution."
		},
		{
			"name": "Infrastructure Security",
			"description": "Implementing security groups, IAM roles, and encrypted communications."
		}
	],
	"challenges_faced": [],
	"outcomes": [],
	"links": []
}
