{
	"id": 4,
	"project_name": "Terraform for AWS Integration with Redshift and Glue",
	"description": "Extended an existing Terraform setup to integrate AWS Redshift with the existing infrastructure, enabling data processing and analytics capabilities.",
	"year": 2023,
	"month": 10,
	"role": "",
	"project_type": "individual",
	"technologies_used": [
		{
			"name": "Terraform",
			"description": "Infrastructure as code tool used to manage and provision AWS resources."
		},
		{
			"name": "AWS Redshift",
			"description": "Fully managed data warehouse service for storing and analyzing large data sets."
		},
		{
			"name": "AWS Glue",
			"description": "Managed ETL service to process and prepare data for analytics."
		}
	],
	"infrastructure": [
		{
			"name": "AWS Redshift",
			"description": "Configured AWS Redshift clusters for data warehousing and analytics.",
			"steps": [
				"Provisioned Redshift clusters for large-scale data storage and analysis.",
				"Ensured Redshift was networked correctly within the VPC."
			]
		},
		{
			"name": "AWS Glue",
			"description": "Configured AWS Glue for ETL processes and data cataloging.",
			"steps": [
				"Set up Glue Data Catalog to manage metadata.",
				"Created ETL jobs for data transformation and loading into Redshift."
			]
		}
	],
	"skills_required": [
		{
			"name": "Infrastructure as Code (IaC)",
			"description": "Proficiency in Terraform to manage AWS infrastructure, including Redshift and Glue."
		},
		{
			"name": "Data Warehousing",
			"description": "Experience with AWS Redshift for large-scale data storage and analytics."
		},
		{
			"name": "Data Integration",
			"description": "Knowledge of AWS Glue for ETL processes and data cataloging."
		},
		{
			"name": "Networking and Security",
			"description": "Understanding of VPC configurations and securing data access."
		},
		{
			"name": "Terraform Integration",
			"description": "Experience managing Terraform scripts for new AWS service integrations."
		}
	],
	"challenges_faced": [],
	"outcomes": [],
	"links": []
}
