{
	"id": 11,
	"project_name": "AWS Services Architecture Implementation Using Terraform",
	"description": "Implemented scalable AWS infrastructure using AWS Elastic Container Service (ECS), AWS Elastic Compute Cloud (EC2), Auto Scaling Groups (ASG) with GPU instances, and Application Load Balancers (ALB) for secure and efficient traffic management. Automated deployment with Terraform.",
	"year": 2024,
	"month": 4,
	"role": "",
	"project_type": "individual",
	"technologies_used": [
		{
			"name": "Terraform",
			"description": "Used for automating the setup of AWS infrastructure, including ECS services, Auto Scaling, Virtual Private Cloud (VPC), and Application Load Balancers (ALB)."
		},
		{
			"name": "AWS VPC & Subnets",
			"description": "Proficiency in configuring VPCs, subnets (public/private), and routing for secure network communications."
		},
		{
			"name": "AWS ECS",
			"description": "Managed containerized applications across multiple ECS clusters."
		},
		{
			"name": "AWS EC2",
			"description": "Provisioned EC2 instances with GPU for high-performance computing."
		},
		{
			"name": "AWS Application Load Balancer (ALB)",
			"description": "Used for load balancing between services and ensuring secure HTTPS communication."
		}
	],
	"infrastructure": [
		{
			"name": "EC2 Auto Scaling Group with GPU Instances",
			"description": "Auto Scaling Group that uses GPU instances to handle traffic surges.",
			"steps": [
				"Configured EC2 Auto Scaling Group with GPU instances.",
				"Set scaling policies based on traffic load."
			]
		},
		{
			"name": "Application Load Balancers",
			"description": "Two load balancers to handle secure HTTPS communication and distribute load across services.",
			"steps": [
				"Configured the first ALB for HTTPS communication between frontend and backend.",
				"Set up the second ALB to manage other traffic."
			]
		},
		{
			"name": "Terraform Infrastructure as Code",
			"description": "Automated the entire infrastructure setup with Terraform.",
			"steps": [
				"Used Terraform to configure ECS services, VPC, ALBs, and Auto Scaling Group."
			]
		}
	],
	"skills_required": [
		{
			"name": "Terraform",
			"description": "Proficiency in using Terraform to automate AWS infrastructure setup."
		},
		{
			"name": "AWS ECS",
			"description": "Experience in deploying and managing containerized applications using ECS."
		},
		{
			"name": "EC2 Auto Scaling",
			"description": "Configuring EC2 Auto Scaling Groups to dynamically scale based on traffic."
		},
		{
			"name": "AWS ALB",
			"description": "Configuring AWS Application Load Balancers (ALBs) for load balancing and secure traffic management."
		}
	],
	"challenges_faced": [
		{
			"name": "Optimizing GPU Instance Usage",
			"description": "Ensuring cost-efficiency by utilizing GPU instances during high traffic periods."
		},
		{
			"name": "Ensuring Secure Communication",
			"description": "Configuring Application Load Balancers (ALBs) for HTTPS communication to enforce secure traffic."
		}
	],
	"outcomes": [
		{
			"name": "Scalable and Secure Infrastructure",
			"description": "Deployed a scalable and secure AWS infrastructure that handled traffic efficiently."
		},
		{
			"name": "Automated Infrastructure Deployment",
			"description": "Automated the entire infrastructure setup using Terraform, reducing manual intervention."
		}
	],
	"links": []
}
