{
    "id": 18,
    "project_name": "Step Functions Workflow Implementation",
    "description": "A project to automate and manage decision-making processes using AWS Step Functions. It ensures data validation, error handling, and efficient task execution.",
    "year": 2024,
    "month": 9,
    "role": "",
    "project_type": "individual",
    "technologies_used": [
        {
            "name": "AWS Step Functions",
            "description": "Used to automate workflows and manage decision-making processes."
        },
        {
            "name": "AWS Lambda",
            "description": "Used in conjunction with Step Functions for serverless computation."
        },
        {
            "name": "Error Handling",
            "description": "Implemented robust error handling and tracking within the workflow."
        },
        {
            "name": "Data Validation",
            "description": "Ensured data accuracy and completeness during various validation steps."
        }
    ],
    "infrastructure": [
        {
            "name": "Step Functions Workflow",
            "description": "An automated workflow system for decision-making with various checkpoints for validation.",
            "steps": [
                "Size Check: Ensures the validity of size data.",
                "Financial Data Validation: Verifies completeness of financial inputs.",
                "Color Check: Ensures valid color selection.",
                "Sample/Serial Status: Manages sample or serial status validation.",
                "Notifications: Sends alerts for missing data or issues."
            ]
        }
    ],
    "skills_required": [
        {
            "name": "Workflow Automation",
            "description": "Designing and automating workflows using Step Functions."
        },
        {
            "name": "AWS Services",
            "description": "Experience with AWS tools like Lambda and Step Functions."
        },
        {
            "name": "Error Handling",
            "description": "Implementing error tracking and ensuring smooth workflow execution."
        },
        {
            "name": "Data Validation",
            "description": "Ensuring data accuracy and completeness at each workflow stage."
        }
    ],
    "challenges_faced": [
        {
            "name": "Complex Workflow Design",
            "description": "Designing a complex workflow with multiple validation steps and conditions."
        },
        {
            "name": "Error Handling Implementation",
            "description": "Implementing robust error handling and ensuring the workflow handles failures gracefully."
        }
    ],
    "outcomes": [
        {
            "name": "Streamlined Decision-Making",
            "description": "Improved decision-making process through automated data validation and clear feedback."
        },
        {
            "name": "Efficient Task Execution",
            "description": "Enabled parallel task execution for improved workflow efficiency."
        }
    ],
    "links": [
        {
            "name": "Project Documentation",
            "url": ""
        }
    ]
}