{
    "id": 9,
    "project_name": "Amazon Connect Call Center Integration and AWS Infrastructure",
    "description": "Designed and implemented a scalable, secure call center system using Amazon Connect, integrating various AWS services like Lambda, DynamoDB, S3, Kinesis Data Firehose, EventBridge, SQS, and QuickSight to enhance customer service and provide real-time data processing and analytics.",
    "year": 2024,
    "month": 2,
    "role": "",
    "project_type": "individual",
    "technologies_used": [
        {
            "name": "Amazon Connect",
            "description": "Implemented custom call flow logic, IVR, and speech-to-text integration."
        },
        {
            "name": "AWS Lambda",
            "description": "Developed API integrations, data processing, and concurrency control functions."
        },
        {
            "name": "Amazon DynamoDB",
            "description": "Used for profile management, locking mechanisms, and real-time session storage."
        },
        {
            "name": "Amazon S3",
            "description": "Stored call recordings, survey results, and logs for analysis."
        },
        {
            "name": "Amazon Kinesis Data Firehose",
            "description": "Enabled real-time data streaming from Amazon Connect to S3."
        },
        {
            "name": "Amazon QuickSight",
            "description": "Created real-time dashboards for operational insights and analytics."
        },
        {
            "name": "Amazon EventBridge",
            "description": "Configured to filter and trigger workflow events from Amazon Connect."
        },
        {
            "name": "Amazon SQS",
            "description": "Managed high-volume event queues for parallel processing."
        },
        {
            "name": "Amazon RDS",
            "description": "Used PostgreSQL for structured relational data storage."
        }
    ],
    "infrastructure": [
        {
            "name": "AWS Cloud Infrastructure",
            "description": "Deployed resources within a VPC for security and optimized cloud performance.",
            "steps": [
                "Configured Amazon Connect with multi-layered call logic.",
                "Integrated IVR, surveys, and speech-to-text capabilities.",
                "Set up Lambda functions for data processing and API communication.",
                "Implemented DynamoDB for real-time data storage and management.",
                "Established data pipelines with Kinesis, S3, and QuickSight.",
                "Configured EventBridge and SQS for asynchronous event handling.",
                "Deployed security measures including IAM roles and VPC peering."
            ]
        }
    ],
    "skills_required": [
        {
            "name": "AWS Cloud Services",
            "description": "Expertise in Amazon Connect, Lambda, DynamoDB, S3, Kinesis, QuickSight, EventBridge, and SQS."
        },
        {
            "name": "API Integrations",
            "description": "Developed functions for real-time customer data verification and third-party service communication."
        },
        {
            "name": "Data Engineering",
            "description": "Handled real-time data ingestion, transformation, and visualization."
        },
        {
            "name": "Security",
            "description": "Implemented secure data transfer, IAM role management, and VPC architecture."
        }
    ],
    "challenges_faced": [
        {
            "name": "Survey Flow Optimization",
            "description": "Resolved logic errors and improved retry mechanisms for surveys."
        },
        {
            "name": "Concurrency and Locking",
            "description": "Implemented a distributed locking system in DynamoDB to prevent race conditions."
        },
        {
            "name": "Real-Time Processing",
            "description": "Optimized Lambda functions for efficient execution of concurrent tasks."
        }
    ],
    "outcomes": [
        {
            "name": "Enhanced Customer Service",
            "description": "Provided seamless call handling, real-time data insights, and improved IVR functionalities."
        },
        {
            "name": "Operational Efficiency",
            "description": "Reduced manual interventions by automating call surveys and customer follow-ups."
        },
        {
            "name": "Improved Data Insights",
            "description": "Developed real-time dashboards for better decision-making and performance monitoring."
        }
    ],
    "links": []
}