{
    "id": 1,
    "project_name": "Terraform for AWS",
    "description": "Automating the deployment of AWS infrastructure using Terraform, including VPC, MongoDB setup, EC2 instance configuration, and ALB setup.",
    "year": 2023,
    "month": 9,
    "role": "",
    "project_type": "individual",
    "technologies_used": [
        {
            "name": "Terraform",
            "description": "Infrastructure as code tool to automate the provisioning of AWS resources."
        },
        {
            "name": "AWS",
            "description": "Cloud platform used to deploy the infrastructure, including EC2, VPC, and ALB."
        }
    ],
    "infrastructure": [
        {
            "name": "VPC Setup",
            "description": "Designed and deployed a VPC with public and private subnets, routing tables, and Internet gateways.",
            "steps": [
                "Created public and private subnets.",
                "Configured routing tables and Internet gateways.",
                "Set up security groups to control traffic."
            ]
        },
        {
            "name": "MongoDB Deployment",
            "description": "Deployed MongoDB in a secure network with backup mechanisms.",
            "steps": [
                "Configured MongoDB storage and backups.",
                "Ensured secure network connectivity for EC2 instances."
            ]
        },
        {
            "name": "EC2 Instance Setup",
            "description": "Configured EC2 instances to interact with MongoDB and handle application traffic.",
            "steps": [
                "Launched EC2 instances with IAM roles.",
                "Set up security groups for secure access."
            ]
        },
        {
            "name": "Application Load Balancer (ALB) Setup",
            "description": "Set up ALB to distribute traffic across EC2 instances in private subnet.",
            "steps": [
                "Configured ALB for traffic distribution.",
                "Set up health checks and auto-scaling."
            ]
        }
    ],
    "skills_required": [
        {
            "name": "Infrastructure as Code (IaC)",
            "description": "Proficient in Terraform to automate the provisioning of AWS infrastructure."
        },
        {
            "name": "Networking",
            "description": "Understanding of AWS VPC, subnets, routing tables, and security groups."
        },
        {
            "name": "Database Management",
            "description": "Experience with deploying and managing MongoDB in the cloud."
        },
        {
            "name": "Server Management",
            "description": "Configuring EC2 instances and managing their lifecycle."
        },
        {
            "name": "Load Balancing",
            "description": "Experience with configuring ALB for traffic management."
        },
        {
            "name": "AWS Services Integration",
            "description": "Integrated multiple AWS services for a scalable and secure infrastructure."
        }
    ],
    "challenges_faced": [],
    "outcomes": [],
    "links": []
}