{
	"id": 6,
	"project_name": "Debugging AWS Services Integration",
	"description": "Debugged an AWS environment involving OpenSearch, RDS, ECS, and other services to resolve deployment issues with GPU-enabled EC2 instances within ECS, enabling successful CI/CD processes.",
	"year": 2023,
	"month": 11,
	"role": "",
	"project_type": "individual",
	"technologies_used": [
		{
			"name": "AWS ECS",
			"description": "Used for container orchestration and deployment of EC2 instances."
		},
		{
			"name": "AWS EC2",
			"description": "Used for running both standard and GPU-enabled EC2 instances."
		},
		{
			"name": "AWS OpenSearch",
			"description": "Search and analytics service for integrating search functionalities."
		},
		{
			"name": "AWS RDS",
			"description": "Relational database service for data storage and querying."
		},
		{
			"name": "AWS VPC",
			"description": "Virtual private cloud for secure networking and resource isolation."
		},
		{
			"name": "Application Load Balancer (ALB)",
			"description": "Distributes incoming traffic across ECS instances."
		},
		{
			"name": "AWS S3",
			"description": "Object storage for logs and artifacts."
		},
		{
			"name": "AWS CodePipeline",
			"description": "CI/CD automation and management tool."
		},
		{
			"name": "CloudWatch",
			"description": "Service for log analysis and monitoring."
		}
	],
	"infrastructure": [
		{
			"name": "Service Integration and Debugging",
			"description": "Integrated various AWS services and debugged issues preventing GPU EC2 instance deployment within ECS.",
			"steps": [
				"Reviewed ECS task definitions and cluster configurations.",
				"Verified resource availability in the VPC and subnets for GPU instances.",
				"Ensured proper IAM roles and permissions for deployment.",
				"Analyzed CloudWatch logs and ECS service events."
			]
		},
		{
			"name": "Issue Identification and Resolution",
			"description": "Resolved the deployment issue preventing GPU EC2 instances from launching within ECS.",
			"steps": [
				"Identified misconfigurations in ECS task definitions and IAM roles.",
				"Corrected VPC, subnet, and task definitions to support GPU EC2 instances.",
				"Tested and confirmed the successful deployment of GPU EC2 instances.",
				"Verified CI/CD pipeline functionality post-resolution."
			]
		}
	],
	"skills_required": [
		{
			"name": "AWS Services",
			"description": "Experience with ECS, EC2, RDS, OpenSearch, and other AWS services."
		},
		{
			"name": "Debugging and Troubleshooting",
			"description": "Skills in analyzing logs and configurations to identify and resolve deployment issues."
		},
		{
			"name": "CI/CD Integration",
			"description": "Experience with AWS CodePipeline and ensuring smooth deployment automation."
		},
		{
			"name": "Resource Management",
			"description": "Managing and troubleshooting resource availability within VPC and subnets."
		}
	],
	"challenges_faced": [],
	"outcomes": [],
	"links": []
}
