{
	"id": 9,
	"project_name": "AWS Connect Call Center Integration and AWS Infrastructure",
	"description": "Designed and implemented a scalable, secure call center system using AWS Connect, integrating various AWS services like AWS Lambda, AWS DynamoDB, AWS S3, AWS Kinesis Data Firehose, AWS EventBridge, AWS Simple Queue Service (SQS), and AWS QuickSight to enhance customer service and provide real-time data processing and analytics.",
	"year": 2024,
	"month": 2,
	"role": "",
	"project_type": "individual",
	"technologies_used": [
		{
			"name": "AWS Connect",
			"description": "Implemented custom call flow logic, IVR, and speech-to-text integration."
		},
		{
			"name": "AWS VPC & Subnets",
			"description": "Proficiency in configuring VPCs, subnets (public/private), and routing for secure network communications."
		},
		{
			"name": "AWS Lambda",
			"description": "Developed API integrations, data processing, and concurrency control functions."
		},
		{
			"name": "AWS DynamoDB",
			"description": "Used for profile management, locking mechanisms, and real-time session storage."
		},
		{
			"name": "AWS S3",
			"description": "Stored call recordings, survey results, and logs for analysis."
		},
		{
			"name": "AWS Kinesis Data Firehose",
			"description": "Enabled real-time data streaming from AWS Connect to AWS S3."
		},
		{
			"name": "AWS QuickSight",
			"description": "Created real-time dashboards for operational insights and analytics."
		},
		{
			"name": "AWS EventBridge",
			"description": "Configured to filter and trigger workflow events from AWS Connect."
		},
		{
			"name": "AWS SQS",
			"description": "Managed high-volume event queues for parallel processing."
		},
		{
			"name": "AWS RDS",
			"description": "Used PostgreSQL for structured relational data storage."
		}
	],
	"infrastructure": [
		{
			"name": "AWS Connect Configuration",
			"description": "Custom call flow logic, IVR, and speech-to-text integration for AWS Connect.",
			"steps": [
				"Set up AWS Connect instance: Configure the cloud contact center for handling customer calls.",
				"Implement IVR: Integrate interactive voice response for routing customer queries.",
				"Integrate speech-to-text: Enable real-time speech recognition and data capture."
			]
		},
		{
			"name": "Lambda Functions",
			"description": "Used AWS Lambda for API integrations and data processing tasks.",
			"steps": [
				"Develop Lambda functions: Automate tasks like data validation and API calls.",
				"Set up event triggers: Configure Lambda to be triggered by AWS Connect events.",
				"Optimize for concurrency: Ensure Lambda functions efficiently handle multiple tasks simultaneously."
			]
		},
		{
			"name": "DynamoDB Integration",
			"description": "Managed customer profiles and session data using AWS DynamoDB.",
			"steps": [
				"Provision DynamoDB tables: Create tables for storing session information and customer profiles.",
				"Implement distributed locking: Use DynamoDBâ€™s conditional writes to handle race conditions.",
				"Configure data retention: Set TTL for session data to automatically expire after a specified time."
			]
		},
		{
			"name": "S3 Integration",
			"description": "Store call recordings, surveys, and logs in Amazon S3 for later analysis.",
			"steps": [
				"Set up S3 buckets: Create storage for call recordings and survey results.",
				"Implement S3 event triggers: Automatically process or analyze data as it's stored.",
				"Enable versioning: Keep track of changes and updates to recordings and results."
			]
		},
		{
			"name": "Kinesis Data Firehose Setup",
			"description": "Stream real-time data from AWS Connect to Amazon S3 using Kinesis Data Firehose.",
			"steps": [
				"Set up Kinesis stream: Configure data flow from AWS Connect to S3 via Firehose.",
				"Enable real-time processing: Stream data to S3 for further processing and analytics.",
				"Integrate with Lambda: Trigger Lambda functions for processing streamed data."
			]
		},
		{
			"name": "QuickSight Dashboard",
			"description": "Create real-time dashboards for operational insights and analytics.",
			"steps": [
				"Connect S3 to QuickSight: Set up data sources for real-time visualization.",
				"Create analytical dashboards: Build dashboards for performance monitoring and insights.",
				"Share insights: Enable team access to dashboards for decision-making."
			]
		},
		{
			"name": "EventBridge Setup",
			"description": "Configure AWS EventBridge for event-driven architecture and workflows.",
			"steps": [
				"Set up EventBridge bus: Create an event bus for routing AWS Connect events.",
				"Filter events: Use rules to filter and trigger specific actions based on event criteria.",
				"Integrate with Lambda: Trigger Lambda functions in response to specific events."
			]
		},
		{
			"name": "SQS Integration",
			"description": "Use AWS SQS to manage event queues for parallel processing.",
			"steps": [
				"Provision SQS queues: Set up queues for handling high-volume events.",
				"Integrate with Lambda: Use SQS to trigger Lambda functions for processing events.",
				"Implement message delay: Ensure optimal processing times by delaying messages as necessary."
			]
		},
		{
			"name": "RDS Setup",
			"description": "Provision AWS RDS for relational data storage using PostgreSQL.",
			"steps": [
				"Create PostgreSQL instance: Deploy a relational database for structured data storage.",
				"Configure backups: Set up automatic backups and scaling for high availability.",
				"Implement data integrity: Ensure data consistency using foreign keys and other relational database features."
			]
		}
	],
	"skills_required": [
		{
			"name": "AWS Cloud Services",
			"description": "Expertise in AWS Connect, AWS Lambda, AWS DynamoDB, AWS S3, AWS Kinesis, AWS QuickSight, AWS EventBridge, and AWS Simple Queue Service (SQS)."
		},
		{
			"name": "API Integrations",
			"description": "Developed functions for real-time customer data verification and third-party service communication."
		},
		{
			"name": "Data Engineering",
			"description": "Handled real-time data ingestion, transformation, and visualization."
		},
		{
			"name": "Security",
			"description": "Implemented secure data transfer, AWS Identity and Access Management (IAM) role management, and VPC architecture."
		}
	],
	"challenges_faced": [
		{
			"name": "Survey Flow Optimization",
			"description": "Resolved logic errors and improved retry mechanisms for surveys."
		},
		{
			"name": "Concurrency and Locking",
			"description": "Implemented a distributed locking system in AWS DynamoDB to prevent race conditions."
		},
		{
			"name": "Real-Time Processing",
			"description": "Optimized AWS Lambda functions for efficient execution of concurrent tasks."
		}
	],
	"outcomes": [
		{
			"name": "Enhanced Customer Service",
			"description": "Provided seamless call handling, real-time data insights, and improved IVR functionalities."
		},
		{
			"name": "Operational Efficiency",
			"description": "Reduced manual interventions by automating call surveys and customer follow-ups."
		},
		{
			"name": "Improved Data Insights",
			"description": "Developed real-time dashboards for better decision-making and performance monitoring."
		}
	],
	"links": []
}
