{
	"id": 10,
	"project_name": "Chat Interface with Large Language Models (LLM) for CLI Command Execution",
	"description": "An interactive chat interface built with Streamlit that integrates multiple Large Language Models (LLMs) to process user queries and execute corresponding CLI commands, with a control mechanism for accuracy and a Retrieval-Augmented Generation (RAG) system for improved performance.",
	"year": 2024,
	"month": 3,
	"role": "",
	"project_type": "individual",
	"technologies_used": [
		{
			"name": "Streamlit",
			"description": "Developed an interactive web-based chat interface."
		},
		{
			"name": "Llama 3",
			"description": "Integrated as one of the LLMs for natural language processing."
		},
		{
			"name": "AWS Bedrock",
			"description": "Leveraged AWS-hosted AI models for command processing."
		},
		{
			"name": "Claude Models",
			"description": "Implemented for conversational AI and execution validation."
		},
		{
			"name": "Retrieval-Augmented Generation (RAG)",
			"description": "Enhanced chatbot accuracy by integrating external data sources."
		}
	],
	"infrastructure": [
		{
			"name": "LLM-Powered Chat System",
			"description": "Implemented a chat interface with real-time command execution and accuracy control.",
			"steps": [
				"Built a user-friendly chat interface using Streamlit.",
				"Integrated multiple Large Language Models (LLMs) for processing user queries.",
				"Designed a command generation and execution framework.",
				"Developed a control model to evaluate and refine command outputs.",
				"Implemented a Retrieval-Augmented Generation (RAG) system to enhance accuracy.",
				"Prevented AI hallucinations through advanced prompt engineering techniques."
			]
		}
	],
	"skills_required": [
		{
			"name": "Streamlit Development",
			"description": "Building interactive web applications using Streamlit."
		},
		{
			"name": "Large Language Model Integration",
			"description": "Integrating various LLMs (e.g., Llama 3, Claude, and AWS models) for specific tasks."
		},
		{
			"name": "Prompt Engineering",
			"description": "Crafting structured and effective prompts to guide AI models for accurate outputs."
		},
		{
			"name": "Retrieval-Augmented Generation (RAG)",
			"description": "Implementing external data retrieval mechanisms to improve chatbot performance."
		},
		{
			"name": "CLI Command Execution",
			"description": "Translating user inputs into executable CLI commands."
		}
	],
	"challenges_faced": [
		{
			"name": "Accuracy of Command Execution",
			"description": "Implemented a control model to prevent incorrect or hallucinated outputs."
		},
		{
			"name": "Minimizing Hallucinations",
			"description": "Used advanced prompting strategies to ensure AI-generated commands align with user intent."
		},
		{
			"name": "Model Selection for Query Complexity",
			"description": "Optimized Large Language Model (LLM) selection to match task complexity for efficient processing."
		}
	],
	"outcomes": [
		{
			"name": "Automated CLI Execution",
			"description": "Enabled users to generate and execute CLI commands seamlessly."
		},
		{
			"name": "Improved Response Accuracy",
			"description": "Reduced AI hallucinations through prompt engineering and control validation."
		},
		{
			"name": "Enhanced Usability",
			"description": "Built an intuitive chat interface that simplifies complex CLI tasks."
		}
	],
	"links": []
}
