{
	"id": 12,
	"project_name": "Migration from Apache Cassandra on EC2 to Apache Cassandra on AWS EKS",
	"description": "Successfully migrated data between two Apache Cassandra clusters, moving from an EC2-hosted environment to AWS EKS-hosted Cassandra. Focused on data consistency, minimal downtime, and schema replication.",
	"year": 2024,
	"month": 5,
	"role": "",
	"project_type": "individual",
	"technologies_used": [
		{
			"name": "Apache Cassandra",
			"description": "Managed and migrated Apache Cassandra databases between EC2 and AWS EKS environments."
		},
		{
			"name": "Apache Spark",
			"description": "Used Apache Spark for efficient large-scale data migration between Apache Cassandra clusters."
		},
		{
			"name": "AWS EKS",
			"description": "Migrated Apache Cassandra to Kubernetes-managed clusters on AWS EKS for improved scalability."
		}
	],
	"infrastructure": [
		{
			"name": "Apache Cassandra on EC2",
			"description": "Original setup with Apache Cassandra hosted on EC2 instances.",
			"steps": [
				"Established secure connection to the source Apache Cassandra cluster on EC2.",
				"Ensured data consistency by replicating schema from EC2 to AWS EKS."
			]
		},
		{
			"name": "Apache Cassandra on AWS EKS",
			"description": "Target setup with Apache Cassandra hosted on AWS EKS (Kubernetes).",
			"steps": [
				"Set up Apache Cassandra on AWS EKS for improved scalability and management.",
				"Ensured high availability and fault tolerance within Kubernetes."
			]
		},
		{
			"name": "Data Migration Using Apache Spark",
			"description": "Used Apache Spark jobs to migrate large datasets between Apache Cassandra clusters.",
			"steps": [
				"Migrated data from EC2-hosted Apache Cassandra to AWS EKS-hosted Apache Cassandra using Apache Spark.",
				"Validated data consistency after migration using Apache Spark tools."
			]
		}
	],
	"skills_required": [
		{
			"name": "Apache Cassandra Administration",
			"description": "Experience in managing and migrating Apache Cassandra databases across EC2 and Kubernetes environments."
		},
		{
			"name": "Apache Spark",
			"description": "Proficiency in using Apache Spark for large-scale data migration tasks."
		},
		{
			"name": "Data Migration Management",
			"description": "Expertise in planning and executing large-scale migrations while ensuring data consistency."
		},
		{
			"name": "AWS EKS Management",
			"description": "Understanding of setting up and managing Apache Cassandra on AWS EKS clusters."
		}
	],
	"challenges_faced": [
		{
			"name": "Minimizing Downtime During Migration",
			"description": "Ensuring minimal downtime during the migration of large datasets."
		},
		{
			"name": "Data Consistency",
			"description": "Ensuring data consistency between the source and target clusters during migration."
		}
	],
	"outcomes": [
		{
			"name": "Successful Data Migration",
			"description": "Successfully migrated the data with no loss and minimal downtime."
		},
		{
			"name": "Seamless Transition to AWS EKS",
			"description": "Migrated to Kubernetes-managed Apache Cassandra on AWS EKS for better scalability."
		}
	],
	"links": [
		{
			"name": "",
			"url": ""
		}
	]
}
